Symbol,Name,Last Sale,Net Change,% Change,Market Cap,Country,IPO Year,Volume,Sector,Industry
QTRX,Quanterix Corporation Common Stock,$41.98,0.10,0.239%,1538483796.00,United States,2017,183795,Health Care,Industrial Specialties
QTT,Qutoutiao Inc. American Depositary Shares,$0.4388,-0.0013,-0.295%,126151381.00,China,2018,784540,Technology,Computer Software: Prepackaged Software
QUBT,Quantum Computing Inc. Common Stock,$5.27,0.33,6.68%,153656415.00,United States,,92131,Technology,Computer Manufacturing
QUIK,QuickLogic Corporation Common Stock,$5.72,0.23,4.189%,67471101.00,United States,1999,23968,Technology,Semiconductors
QUMU,Qumu Corporation Common Stock,$2.33,0.05,2.193%,41432165.00,United States,,12510,Technology,Retail: Computer Software & Peripheral Equipment
QURE,uniQure N.V. Ordinary Shares,$29.20,0.40,1.389%,1349455925.00,Netherlands,2014,82666,Health Care,Biotechnology: Pharmaceutical Preparations
RACB,Research Alliance Corp. II Class A Common Stock,$9.85,0.00,0.00%,188987025.00,United States,2021,4,,
RADA,RADA Electronic Industries Ltd. Ordinary Shares,$9.85,0.20,2.073%,428327890.00,Israel,,114440,,
RADI,Radius Global Infrastructure Inc. Class A Common Stock,$16.0499,-0.0501,-0.311%,1215827706.00,United States,,237540,Consumer Services,Telecommunications Equipment
RAIL,FreightCar America Inc. Common Stock,$3.995,0.255,6.818%,63709176.00,United States,2005,208293,Capital Goods,Railroads
RAIN,Rain Therapeutics Inc. Common Stock,$14.08,0.22,1.587%,372651784.00,United States,2021,10704,Health Care,Biotechnology: Pharmaceutical Preparations
RAM,Aries I Acquisition Corporation Class A Ordinary Share,$9.97,0.00,0.00%,179148438.00,Cayman Islands,2021,8,Finance,Business Services
RAMMU,Aries I Acquisition Corporation Unit,$10.30,0.00,0.00%,0.00,Cayman Islands,2021,94,Finance,Business Services
RAMMW,Aries I Acquisition Corporation Warrant,$0.686,0.00,0.00%,0.00,Cayman Islands,2021,100,Finance,Business Services
RAND,Rand Capital Corporation Common Stock,$17.295,0.245,1.437%,44638758.00,United States,,212,Finance,Finance/Investors Services
RANI,Rani Therapeutics Holdings Inc. Class A Common Stock,$22.15,-1.35,-5.745%,436618009.00,United States,2021,15249,Consumer Durables,Specialty Chemicals
RAPT,RAPT Therapeutics Inc. Common Stock,$30.965,0.605,1.993%,914893686.00,United States,2019,48156,Health Care,Biotechnology: Pharmaceutical Preparations
RARE,Ultragenyx Pharmaceutical Inc. Common Stock,$82.70,-1.74,-2.061%,5637016008.00,United States,2014,74608,Health Care,Biotechnology: Pharmaceutical Preparations
RAVE,Rave Restaurant Group Inc. Common Stock,$1.22,0.01,0.826%,21965983.00,United States,,48537,Consumer Services,Restaurants
RBB,RBB Bancorp Common Stock,$24.61,-0.49,-1.952%,480298432.00,United States,2017,13181,Finance,Commercial Banks
RBBN,Ribbon Communications Inc. Common Stock,$5.66,0.08,1.434%,841216906.00,United States,,47035,Technology,EDP Services
RBCAA,Republic Bancorp Inc. Class A Common Stock,$53.40,-0.64,-1.184%,1079107627.00,United States,1998,10338,Finance,Major Banks
RBCN,Rubicon Technology Inc. Common Stock,$9.41,-0.0001,-0.001%,23013858.00,United States,2007,213,Technology,Semiconductors
RBKB,Rhinebeck Bancorp Inc. Common Stock,$10.7162,0.1262,1.192%,121058447.00,United States,2019,1403,Finance,Major Banks
RBNC,Reliant Bancorp Inc. Common Stock,$34.60,0.57,1.675%,573553128.00,United States,,21382,Finance,Major Banks
RCAT,Red Cat Holdings Inc. Common Stock,$2.035,0.015,0.743%,109239056.00,United States,,336445,Technology,Retail: Computer Software & Peripheral Equipment
RCEL,Avita Therapeutics Inc. Common Stock,$13.55,0.19,1.422%,337735349.00,United States,,17188,Health Care,Medical Specialities
RCHG,Recharge Acquisition Corp. Class A Common Stock,$9.89,-0.03,-0.302%,247744500.00,United States,2020,124,,
RCHGU,Recharge Acquisition Corp. Unit,$10.19,0.0434,0.428%,0.00,United States,2020,30211,,
RCHGW,Recharge Acquisition Corp. Warrant,$0.59,-0.01,-1.667%,0.00,United States,2020,1800,,
RCII,Rent-A-Center Inc. Common Stock,$50.915,1.665,3.381%,3367530218.00,United States,1995,557687,Technology,Diversified Commercial Services
RCKT,Rocket Pharmaceuticals Inc. Common Stock,$25.29,0.29,1.16%,1629753379.00,United States,2015,97263,Health Care,Biotechnology: Pharmaceutical Preparations
RCKY,Rocky Brands Inc. Common Stock,$35.80,0.22,0.618%,261347124.00,United States,1993,25289,Consumer Non-Durables,Shoe Manufacturing
RCLF,Rosecliff Acquisition Corp I Class A Common Stock,$9.82,0.01,0.102%,310557500.00,United States,2021,20626,,
RCLFU,Rosecliff Acquisition Corp I Unit,$10.10,0.0099,0.098%,0.00,United States,2021,17125,,
RCLFW,Rosecliff Acquisition Corp I Warrants,$0.9401,-0.0199,-2.073%,0.00,United States,2021,9724,,
RCM,R1 RCM Inc. Common Stock,$25.40,0.44,1.763%,7051147823.00,United States,,641628,Consumer Services,Other Consumer Services
RCMT,RCM Technologies Inc. Common Stock,$8.3589,0.3589,4.486%,87634841.00,United States,,60673,Consumer Services,Military/Government/Technical
RCON,Recon Technology Ltd. Class A Ordinary Shares,$1.75,0.06,3.55%,12604956.00,China,2009,204947,Energy,Oilfield Services/Equipment
RCRT,Recruiter.com Group Inc. Common Stock,$3.78,0.18,5.00%,54410564.00,United States,,70562,,
RCRTW,Recruiter.com Group Inc. Warrant,$1.09,-0.01,-0.909%,0.00,United States,,27604,,
RDBX,Redbox Entertainment Inc. Class A Common Stock,$11.23,0.92,8.923%,141705935.00,United States,2020,117426,,
RDBXW,Redbox Entertainment Inc. Warrant,$1.565,0.1151,7.938%,0.00,United States,2020,65626,,
RDCM,Radcom Ltd. Ordinary Shares,$11.28,-0.0301,-0.266%,157284440.00,Israel,1997,400,Technology,Computer peripheral equipment
RDFN,Redfin Corporation Common Stock,$42.61,1.56,3.80%,4494560238.00,United States,2017,334190,Finance,Real Estate
RDHL,Redhill Biopharma Ltd. American Depositary Shares,$3.07,0.11,3.716%,160872921.00,Israel,,329314,Health Care,Biotechnology: Pharmaceutical Preparations
RDI,Reading International Inc Class A Common Stock,$4.25,0.01,0.236%,92689971.00,United States,,1159,Consumer Services,Movies/Entertainment
RDIB,Reading International Inc Class B Common Stock,$24.70,-0.10,-0.403%,538692304.00,United States,,106,Consumer Services,Movies/Entertainment
RDNT,RadNet Inc. Common Stock,$28.875,0.525,1.852%,1542984655.00,United States,,43392,Health Care,Medical Specialities
RDUS,Radius Health Inc. Common Stock,$7.98,-6.40,-44.506%,377790836.00,United States,2014,5318798,Health Care,Biotechnology: Pharmaceutical Preparations
RDVT,Red Violet Inc. Common Stock ,$39.0701,-0.1399,-0.357%,524259754.00,United States,,7047,Technology,Computer Software: Prepackaged Software
RDWR,Radware Ltd. Ordinary Shares,$30.81,0.71,2.359%,1417220286.00,Israel,1999,120751,Miscellaneous,Business Services
REAL,The RealReal Inc. Common Stock,$14.28,0.41,2.956%,1319298012.00,United States,2019,1294606,Consumer Non-Durables,Consumer Specialties
REAX,The Real Brokerage Inc. Common Shares,$3.74,0.01,0.268%,666318400.00,Canada,,109592,,
REDU,RISE Education Cayman Ltd American Depositary Shares,$0.56,0.0053,0.955%,31630427.00,China,2017,996363,Miscellaneous,Service to the Health Industry
REE,REE Automotive Ltd. Class A Ordinary Shares,$4.275,0.215,5.296%,1339542787.00,Israel,,907287,,
REEAW,REE Automotive Ltd. Warrant,$0.73,0.02,2.817%,0.00,Israel,,6039,,
REED,Reeds Inc. Common Stock,$0.4121,-0.008,-1.904%,38625857.00,United States,,109099,Consumer Non-Durables,Beverages (Production/Distribution)
REFI,Chicago Atlantic Real Estate Finance Inc. Common Stock,$16.6441,0.6441,4.026%,289869867.00,United States,,822517,,
REFR,Research Frontiers Incorporated Common Stock,$1.89,-0.01,-0.526%,59819248.00,United States,,106410,Capital Goods,Industrial Machinery/Components
REG,Regency Centers Corporation Common Stock,$74.54,0.41,0.553%,12762217244.00,United States,1993,218618,Consumer Services,Real Estate Investment Trusts
REGI,Renewable Energy Group Inc. Common Stock,$46.29,0.20,0.434%,2327021538.00,United States,2012,348540,Basic Industries,Major Chemicals
REGN,Regeneron Pharmaceuticals Inc. Common Stock,$642.9759,7.8859,1.242%,69147568787.00,United States,1991,184499,Health Care,Biotechnology: Pharmaceutical Preparations
REKR,Rekor Systems Inc. Common Stock,$7.08,0.55,8.423%,311358703.00,United States,,567013,Technology,EDP Services
RELI,Reliance Global Group Inc. Common Stock,$1.98,0.01,0.508%,21693096.00,United States,,40401,Finance,Specialty Insurers
RELL,Richardson Electronics Ltd. Common Stock,$12.50,1.33,11.907%,165095675.00,United States,1983,269639,Technology,Electronic Components
RELY,Remitly Global Inc. Common Stock,$21.225,-0.175,-0.818%,3483160038.00,United States,2021,229181,Technology,Computer Software: Prepackaged Software
RENT,Rent the Runway Inc. Class A Common Stock,$12.01,-0.80,-6.245%,755052763.00,United States,2021,528519,Consumer Non-Durables,Department/Specialty Retail Stores
REPH,Recro Pharma Inc. Common Stock,$1.5564,0.0264,1.725%,72550862.00,United States,2014,14190,Health Care,Biotechnology: Pharmaceutical Preparations
REPL,Replimune Group Inc. Common Stock,$29.235,0.135,0.464%,1370930654.00,United States,2018,96131,Health Care,Biotechnology: Pharmaceutical Preparations
RESN,Resonant Inc. Common Stock,$2.0499,0.0499,2.495%,134700143.00,United States,2014,159838,Technology,Semiconductors
RETA,Reata Pharmaceuticals Inc. Class A Common Stock,$54.42,0.00,0.00%,1980443225.00,United States,2016,96,Health Care,Biotechnology: Pharmaceutical Preparations
RETO,ReTo Eco-Solutions Inc. Common Shares,$0.8399,0.05,6.33%,23164023.00,China,2017,437978,Capital Goods,Multi-Sector Companies
REVE,Alpine Acquisition Corporation Common Stock,$10.00,0.00,0.00%,135750000.00,United States,2021,5,,
REVEU,Alpine Acquisition Corporation Unit,$10.25,0.00,0.00%,0.00,United States,2021,1,,
REVEW,Alpine Acquisition Corporation Warrant,$0.51,-0.01,-1.923%,0.00,United States,2021,200,,
REVH,Revolution Healthcare Acquisition Corp. SAIL Class A Common Stock,$9.76,0.02,0.205%,563640000.00,United States,2021,1856,,
REVHU,Revolution Healthcare Acquisition Corp. SAIL Units,$9.90,0.00,0.00%,0.00,United States,2021,626,,
REVHW,Revolution Healthcare Acquisition Corp. SAIL Warrant.,$0.83,0.0001,0.012%,0.00,United States,2021,2530,,
REYN,Reynolds Consumer Products Inc. Common Stock,$29.74,0.14,0.473%,6238276437.00,United States,2020,55514,Capital Goods,Office Equipment/Supplies/Services
RFIL,RF Industries Ltd. Common Stock,$6.68,-0.05,-0.743%,67071195.00,United States,,3867,Capital Goods,Electrical Products
RGC,Regencell Bioscience Holdings Limited Ordinary Shares,$27.00,0.05,0.186%,350111835.00,Hong Kong,2021,5820,,
RGCO,RGC Resources Inc. Common Stock,$23.2595,0.209,0.907%,195058540.00,United States,,3434,Public Utilities,Oil & Gas Production
RGEN,Repligen Corporation Common Stock,$263.525,4.855,1.877%,14569909341.00,United States,1986,124823,Health Care,Medical/Dental Instruments
RGF,The Real Good Food Company Inc. Class A Common Stock,$7.655,-0.275,-3.468%,197097618.00,United States,2021,135271,Consumer Non-Durables,Food Distributors
RGLD,Royal Gold Inc. Common Stock,$100.1475,-0.4125,-0.41%,6573410600.00,United States,,127357,,
RGLS,Regulus Therapeutics Inc. Common Stock,$0.379,0.0128,3.495%,55323079.00,United States,2012,561458,Health Care,Biotechnology: Pharmaceutical Preparations
RGNX,REGENXBIO Inc. Common Stock,$32.80,0.84,2.628%,1402830022.00,United States,2015,58826,Health Care,Biotechnology: Biological Products (No Diagnostic Substances)
RGP,Resources Connection Inc. Common Stock,$17.22,0.15,0.879%,571475663.00,United States,,20314,Miscellaneous,Business Services
RIBT,RiceBran Technologies Common Stock,$0.4039,-0.0023,-0.566%,20588259.00,United States,,241717,Consumer Non-Durables,Specialty Foods
RICK,RCI Hospitality Holdings Inc. Common Stock,$66.00,1.02,1.57%,593994060.00,United States,1995,7395,Consumer Services,Restaurants
RICO,Agrico Acquisition Corp. Class A Ordinary Shares,$10.06,0.02,0.199%,182211750.00,Cayman Islands,2021,38222,,
RICOU,Agrico Acquisition Corp. Unit,$10.08,-0.17,-1.659%,0.00,Cayman Islands,2021,25000,,
RICOW,Agrico Acquisition Corp. Warrant,$0.48,-0.0599,-11.095%,0.00,Cayman Islands,2021,12400,,
RIDE,Lordstown Motors Corp. Class A Common Stock,$4.52,0.23,5.361%,868883682.00,United States,2019,4186735,Capital Goods,Construction/Ag Equipment/Trucks
RIGL,Rigel Pharmaceuticals Inc. Common Stock,$2.605,-0.015,-0.573%,445470789.00,United States,2000,437149,Health Care,Biotechnology: Pharmaceutical Preparations
RILY,B. Riley Financial Inc. Common Stock,$78.26,1.65,2.154%,2157593218.00,United States,,50492,Finance,Investment Managers
RILYG,B. Riley Financial Inc. 5.00% Senior Notes due 2026,$24.79,-0.01,-0.04%,0.00,United States,,64038,Miscellaneous,Business Services
RILYK,B. Riley Financial Inc. 5.50% Senior Notes Due 2026,$25.69,0.07,0.273%,0.00,United States,,2479,Miscellaneous,Business Services
RILYL,B. Riley Financial Inc. Depositary Shares each representing 1/1000th in a share of 7.375% Series B Cumulative Perpetual Preferred Stock par value $0.0001,$27.30,-0.35,-1.266%,0.00,United States,,153,Finance,Investment Managers
RILYM,B. Riley Financial Inc. 6.375% Senior Notes due 2025,$25.7901,0.0401,0.156%,0.00,United States,,1007,Miscellaneous,Business Services
RILYN,B. Riley Financial Inc. 6.50% Senior Notes Due 2026,$26.3199,0.2599,0.997%,0.00,United States,,14893,Miscellaneous,Business Services
RILYO,B. Riley Financial Inc. 6.75% Senior Notes due 2024,$25.7438,0.0038,0.015%,0.00,United States,,225,Miscellaneous,Business Services
RILYP,B. Riley Financial Inc. Depositary Shares each representing a 1/1000th fractional interest in a share of Series A Cumulative Perpetual Preferred Stock,$27.0101,0.1951,0.728%,0.00,United States,,1958,Finance,Investment Managers
RILYT,B. Riley Financial Inc. 6.00% Senior Notes Due 2028,$25.70,0.15,0.587%,0.00,United States,,4145,Miscellaneous,Business Services
RILYZ,B. Riley Financial Inc. 5.25% Senior Notes due 2028,$24.78,-0.02,-0.081%,0.00,United States,,31019,Miscellaneous,Business Services
RIOT,Riot Blockchain Inc.  Common Stock ,$29.6201,-0.0599,-0.202%,3453211966.00,United States,,6466973,Technology,Retail: Computer Software & Peripheral Equipment
RIVN,Rivian Automotive Inc. Class A Common Stock,$119.9087,3.7287,3.209%,106865888002.00,United States,2021,7156832,Capital Goods,Auto Manufacturing
RKDA,Arcadia Biosciences Inc. Common Stock,$1.32,0.11,9.091%,29283190.00,United States,2015,124945,Basic Industries,Agricultural Chemicals
RKLB,Rocket Lab USA Inc. Common Stock,$13.085,0.185,1.434%,5877841615.00,United States,2020,1659511,Capital Goods,Aerospace
RKLBW,Rocket Lab USA Inc. Warrant,$4.53,0.18,4.138%,0.00,United States,2020,86470,Capital Goods,Aerospace
RLAY,Relay Therapeutics Inc. Common Stock,$30.29,0.79,2.678%,3272657091.00,United States,2020,78519,Health Care,Biotechnology: Pharmaceutical Preparations
RLMD,Relmada Therapeutics Inc. Common Stock,$18.37,0.08,0.437%,322041347.00,United States,,11013,Health Care,Biotechnology: Pharmaceutical Preparations
RLYB,Rallybio Corporation Common Stock,$12.21,-0.16,-1.293%,392306934.00,United States,2021,1203,Health Care,Biotechnology: Pharmaceutical Preparations
RMBI,Richmond Mutual Bancorporation Inc. Common Stock,$16.16,0.00,0.00%,200779742.00,United States,2019,31,,
RMBL,RumbleOn Inc. Class B Common Stock,$41.40,0.00,0.00%,618185711.00,United States,,69488,Capital Goods,Automotive Aftermarket
RMBS,Rambus Inc. Common Stock,$28.8063,0.1663,0.581%,3150394345.00,United States,1997,759194,Technology,Semiconductors
RMCF,Rocky Mountain Chocolate Factory Inc. Common Stock,$8.30,-0.02,-0.24%,50858922.00,United States,,2576,Consumer Non-Durables,Specialty Foods
RMGC,RMG Acquisition Corp. III Class A Ordinary Shares,$9.80,0.00,0.00%,591675000.00,United States,2021,22,Finance,Business Services
RMGCU,RMG Acquisition Corp. III Unit,$9.9736,0.0136,0.137%,0.00,United States,2021,100,Finance,Business Services
RMGCW,RMG Acquisition Corp. III Warrant,$0.8799,-0.0101,-1.135%,0.00,United States,2021,5871,Finance,Business Services
RMNI,Rimini Street Inc. (DE) Common Stock,$5.84,-0.03,-0.511%,507712080.00,United States,2015,265811,Technology,EDP Services
RMR,The RMR Group Inc. Class A Common Stock,$34.43,0.75,2.227%,567578929.00,United States,,34082,Finance,Real Estate
RMTI,Rockwell Medical Inc. (DE) Common Stock,$0.4399,0.0238,5.72%,41335811.00,United States,1998,575453,Health Care,Biotechnology: Pharmaceutical Preparations
RNA,Avidity Biosciences Inc. Common Stock,$26.52,1.18,4.657%,1243710641.00,United States,2020,18950,Health Care,Biotechnology: Pharmaceutical Preparations
RNAZ,TransCode Therapeutics Inc. Common Stock,$2.87,0.05,1.773%,37036127.00,United States,2021,13399,Health Care,Biotechnology: Pharmaceutical Preparations
RNDB,Randolph Bancorp Inc. Common Stock,$22.90,-0.305,-1.314%,116796320.00,United States,2016,1271,Finance,Major Banks
RNERU,Mount Rainier Acquisition Corp. Unit,$10.185,0.015,0.147%,0.00,United States,2021,50020,,
RNLX,Renalytix plc American Depositary Shares,$15.245,-0.285,-1.835%,551174819.00,United Kingdom,2020,68876,Health Care,Medical Specialities
RNST,Renasant Corporation Common Stock,$36.76,-0.34,-0.916%,2049274681.00,United States,,49991,Finance,Major Banks
RNW,ReNew Energy Global plc Class A Ordinary Shares,$8.26,0.06,0.732%,3310033872.00,United Kingdom,,167186,,
RNWK,RealNetworks Inc. Common Stock,$1.19,0.05,4.386%,56085158.00,United States,1997,96289,Technology,EDP Services
RNWWW,ReNew Energy Global plc Warrant,$1.70,0.05,3.03%,0.00,United Kingdom,,1213,,
RNXT,RenovoRx Inc. Common Stock,$5.8312,0.1412,2.482%,51945204.00,United States,2021,115405,Health Care,Biotechnology: Pharmaceutical Preparations
ROAD,Construction Partners Inc. Class A Common Stock,$33.41,-0.20,-0.595%,1749693193.00,United States,2018,47810,Capital Goods,Engineering & Construction
ROCAU,ROC Energy Acquisition Corp. Unit,$10.03,0.00,0.00%,0.00,United States,2021,5506,,
ROCC,Ranger Oil Corporation Class A Common Stock,$29.95,-0.44,-1.448%,631593177.00,United States,,108271,Energy,Oil & Gas Production
ROCG,Roth CH Acquisition IV Co. Common Stock,$9.85,0.00,0.00%,146139525.00,United States,2021,4,,
ROCGW,Roth CH Acquisition IV Co. Warrant,$0.80,0.00,0.00%,0.00,United States,2021,2,,
ROCK,Gibraltar Industries Inc. Common Stock,$73.05,0.83,1.149%,2387296792.00,United States,1993,22271,,
ROCLU,Roth CH Acquisition V Co. Unit,$10.02,0.00,0.00%,0.00,United States,2021,24,Finance,Business Services
ROCR,Roth CH Acquisition III Co. Common stock,$9.91,0.00,0.00%,146499530.00,United States,2021,40,,
ROCRU,Roth CH Acquisition III Co. Unit,$10.19,0.01,0.098%,0.00,United States,2021,50100,,
ROCRW,Roth CH Acquisition III Co. Warrant,$1.21,0.00,0.00%,0.00,United States,2021,6600,,
ROIC,Retail Opportunity Investments Corp. Common Stock (MD),$18.82,0.17,0.912%,2285192453.00,United States,,254673,Consumer Services,Real Estate Investment Trusts
ROIV,Roivant Sciences Ltd. Common Shares,$10.24,0.57,5.895%,7012241091.00,United Kingdom,,394639,,
ROIVW,Roivant Sciences Ltd. Warrant,$2.01,0.32,18.935%,0.00,United Kingdom,,490785,,
ROKU,Roku Inc. Class A Common Stock,$252.60,36.00,16.62%,33940032923.00,United States,2017,13975488,Consumer Services,Television Services
ROLL,RBC Bearings Incorporated Common Stock,$208.14,2.07,1.005%,6009051962.00,United States,2005,19301,Capital Goods,Metal Fabrications
ROLLP,RBC Bearings Incorporated 5.00% Series A Mandatory Convertible Preferred Stock,$108.40,0.69,0.641%,0.00,United States,,7174,Capital Goods,Metal Fabrications
ROOT,Root Inc. Class A Common Stock,$3.8685,0.1685,4.554%,976796250.00,United States,2020,1335715,Finance,Property-Casualty Insurers
ROSE,Rose Hill Acquisition Corporation Class A Ordinary Shares,$9.89,0.01,0.101%,0.00,United States,2021,1064,,
ROSEU,Rose Hill Acquisition Corporation Unit,$10.10,0.00,0.00%,0.00,United States,2021,4,,
ROSEW,Rose Hill Acquisition Corporation Warrant,$0.456,-0.024,-5.00%,0.00,United States,2021,228568,,
ROST,Ross Stores Inc. Common Stock,$112.86,-0.24,-0.212%,40106602358.00,United States,1985,501441,Consumer Services,Clothing/Shoe/Accessory Stores
ROVR,Rover Group Inc. Class A Common Stock,$11.305,-0.345,-2.961%,1983491813.00,United States,2021,276586,Miscellaneous,Other Consumer Services
ROVRW,Rover Group Inc. Warrant,$3.44,0.01,0.292%,0.00,United States,2021,6158,Miscellaneous,Other Consumer Services
RPAY,Repay Holdings Corporation Class A Common Stock,$18.41,0.49,2.734%,1666833336.00,United States,2018,165249,Technology,EDP Services
RPD,Rapid7 Inc. Common Stock,$118.34,-0.44,-0.37%,6765100769.00,United States,2015,82342,Technology,Computer Software: Prepackaged Software
RPHM,Reneo Pharmaceuticals Inc. Common Stock,$7.45,0.05,0.676%,181958055.00,United States,2021,5692,Health Care,Biotechnology: Pharmaceutical Preparations
RPID,Rapid Micro Biosystems Inc. Class A Common Stock,$10.33,-0.22,-2.085%,427171563.00,United States,2021,38336,Health Care,Medical Specialities
RPRX,Royalty Pharma plc Class A Ordinary Shares ,$39.36,0.81,2.101%,16905553511.00,United States,2020,572711,Health Care,Biotechnology: Pharmaceutical Preparations
RPTX,Repare Therapeutics Inc. Common Shares,$23.00,0.22,0.966%,959906311.00,Canada,2020,73892,,
RRBI,Red River Bancshares Inc. Common Stock,$53.43,0.32,0.603%,388778052.00,United States,2019,465,Finance,Commercial Banks
RRGB,Red Robin Gourmet Burgers Inc. Common Stock,$18.33,1.10,6.384%,288077598.00,United States,2002,159682,Consumer Services,Restaurants
RRR,Red Rock Resorts Inc. Class A Common Stock,$50.6916,2.0416,4.197%,3484655502.00,United States,2016,840461,Consumer Services,Recreational Products/Toys
RSLS,ReShape Lifesciences Inc. Common Stock,$1.905,0.035,1.872%,30179362.00,United States,2016,107679,Health Care,Biotechnology: Electromedical & Electrotherapeutic Apparatus
RSSS,Research Solutions Inc Common Stock,$2.325,0.065,2.876%,62180077.00,United States,,14830,Technology,Computer Software: Prepackaged Software
RSVR,Reservoir Media Inc. Common Stock,$7.82,0.11,1.427%,501021558.00,United States,2021,38261,Consumer Services,Movies/Entertainment
RSVRW,Reservoir Media Inc. Warrant,$1.72,-0.04,-2.273%,0.00,United States,2021,330,Consumer Services,Movies/Entertainment
RTLR,Rattler Midstream LP Common Units,$11.24,0.15,1.353%,448540832.00,United States,2019,78475,Energy,Oilfield Services/Equipment
RUBY,Rubius Therapeutics Inc. Common Stock,$13.34,0.23,1.754%,1198809465.00,United States,2018,53848,Health Care,Biotechnology: Biological Products (No Diagnostic Substances)
RUN,Sunrun Inc. Common Stock,$44.64,0.82,1.871%,9240699048.00,United States,2015,3384657,Capital Goods,Building Products
RUSHA,Rush Enterprises Inc. Common Stock Cl A,$54.7725,0.1425,0.261%,3040559830.00,United States,,49633,Consumer Services,Other Specialty Stores
RUSHB,Rush Enterprises Inc. Class B,$53.42,0.19,0.357%,2965479139.00,United States,,1285,Consumer Services,Other Specialty Stores
RUTH,Ruth's Hospitality Group Inc. Common Stock,$19.88,0.74,3.866%,682214366.00,United States,2005,93389,Consumer Services,Restaurants
RVAC,Riverview Acquisition Corp. Class A Common Stock,$9.72,-0.01,-0.103%,303750000.00,United States,2021,53326,,
RVACU,Riverview Acquisition Corp. Unit,$9.95,-0.05,-0.50%,0.00,United States,2021,100,,
RVACW,Riverview Acquisition Corp. Warrant,$0.5252,-0.0013,-0.247%,0.00,United States,2021,3200,,
RVMD,Revolution Medicines Inc. Common Stock,$26.755,-0.595,-2.176%,1971498735.00,United States,2020,176719,Consumer Durables,Specialty Chemicals
RVNC,Revance Therapeutics Inc. Common Stock,$16.74,0.46,2.826%,1201845822.00,United States,2014,259017,Health Care,Biotechnology: Pharmaceutical Preparations
RVPH,Reviva Pharmaceuticals Holdings Inc. Common Stock ,$3.66,-0.02,-0.543%,18792464.00,United States,2020,65082,Health Care,Biotechnology: Pharmaceutical Preparations
RVPHW,Reviva Pharmaceuticals Holdings Inc. Warrants,$0.47,0.0151,3.319%,0.00,United States,2018,7000,Health Care,Biotechnology: Pharmaceutical Preparations
RVSB,Riverview Bancorp Inc Common Stock,$7.62,-0.14,-1.804%,168895067.00,United States,,11898,Finance,Major Banks
RWAY,Runway Growth Finance Corp. Common Stock,$13.225,0.205,1.575%,547258620.00,United States,2021,51715,,
RWLK,ReWalk Robotics Ltd. Ordinary Shares,$1.3699,0.0499,3.78%,85558281.00,Israel,2014,570340,Health Care,Industrial Specialties
RXDX,Prometheus Biosciences Inc. Common Stock,$33.225,1.115,3.472%,1293755585.00,United States,2021,205813,Health Care,Biotechnology: Pharmaceutical Preparations
RXRA,RXR Acquisition Corp. Class A Common Stock,$9.76,-0.01,-0.102%,420900000.00,United States,2021,25217,,
RXRAU,RXR Acquisition Corp. Units,$9.92,0.02,0.202%,0.00,United States,2021,3729,,
RXRAW,RXR Acquisition Corp. Warrants to purchase Class A common stock,$0.75,0.0369,5.175%,0.00,United States,2021,1600,,
RXRX,Recursion Pharmaceuticals Inc. Class A Common Stock,$19.97,-0.75,-3.62%,3374791668.00,United States,2021,1655646,Health Care,Biotechnology: Pharmaceutical Preparations
RXST,RxSight Inc. Common Stock,$12.12,0.41,3.501%,331529450.00,United States,2021,32016,Health Care,Biotechnology: Electromedical & Electrotherapeutic Apparatus
RXT,Rackspace Technology Inc. Common Stock,$13.8902,0.1902,1.388%,2917387486.00,United States,2020,398416,Technology,EDP Services
RYAAY,Ryanair Holdings plc American Depositary Shares,$101.61,0.30,0.296%,23026492912.00,Ireland,1997,333069,Transportation,Air Freight/Delivery Services
RYTM,Rhythm Pharmaceuticals Inc. Common Stock,$10.26,0.43,4.374%,515752881.00,United States,2017,88824,Health Care,Biotechnology: Pharmaceutical Preparations
RZLT,Rezolute Inc. Common Stock (NV),$4.89,0.17,3.602%,75502823.00,United States,,11221,Health Care,Biotechnology: Pharmaceutical Preparations
SABR,Sabre Corporation Common Stock,$9.47,0.56,6.285%,3062950445.00,United States,2014,4237186,Technology,EDP Services
SABRP,Sabre Corporation 6.50% Series A Mandatory Convertible Preferred Stock,$118.88,0.00,0.00%,0.00,United States,,164,Technology,EDP Services
