Symbol,Name,Last Sale,Net Change,% Change,Market Cap,Country,IPO Year,Volume,Sector,Industry
CZR,Caesars Entertainment Inc. Common Stock,$93.89,3.51,3.884%,20071245742.00,United States,,1014456,Consumer Services,Hotels/Resorts
CZWI,Citizens Community Bancorp Inc. Common Stock,$13.75,0.07,0.512%,144408578.00,United States,,106,Finance,Savings Institutions
DADA,Dada Nexus Limited American Depositary Shares,$17.60,0.34,1.97%,4117205083.00,China,2020,379355,Consumer Services,Department/Specialty Retail Stores
DAIO,Data I/O Corporation Common Stock,$4.50,-0.13,-2.808%,38794532.00,United States,1981,27783,Capital Goods,Industrial Machinery/Components
DAKT,Daktronics Inc. Common Stock,$5.155,0.205,4.141%,234371853.00,United States,1994,417998,Capital Goods,Office Equipment/Supplies/Services
DALN,DallasNews Corporation Series A Common Stock,$6.44,0.14,2.222%,34470036.00,United States,,5489,Consumer Services,Newspapers/Magazines
DAOOU,Crypto 1 Acquisition Corp Unit,$10.08,-1.07,-9.596%,0.00,United States,2021,94640,,
DARE,Dare Bioscience Inc. Common Stock,$2.066,-0.056,-2.639%,158258955.00,United States,2014,94814640,Health Care,Biotechnology: Pharmaceutical Preparations
DATS,DatChat Inc. Common Stock,$3.8313,0.0913,2.441%,75083591.00,United States,2021,1914552,Technology,Computer Software: Prepackaged Software
DATSW,DatChat Inc. Series A Warrant,$2.1101,-0.1899,-8.257%,0.00,United States,2021,1139,Technology,Computer Software: Prepackaged Software
DAWN,Day One Biopharmaceuticals Inc. Common Stock,$17.93,-0.07,-0.389%,1110385876.00,United States,2021,153832,Health Care,Biotechnology: Pharmaceutical Preparations
DBDR,Roman DBDR Tech Acquisition Corp. Class A Common Stock,$10.1666,-0.0034,-0.033%,294272237.00,United States,2020,17223,,
DBDRW,Roman DBDR Tech Acquisition Corp. Warrant,$1.86,0.10,5.682%,0.00,United States,2020,3100,,
DBGI,Digital Brands Group Inc. Common Stock,$2.52,0.09,3.704%,32148870.00,United States,2021,71711,Consumer Non-Durables,Apparel
DBGIW,Digital Brands Group Inc. Warrant,$0.82,0.0395,5.061%,0.00,United States,2021,2200,Consumer Non-Durables,Apparel
DBTX,Decibel Therapeutics Inc. Common Stock,$6.4812,0.1212,1.906%,161533300.00,United States,2021,6275,Health Care,Biotechnology: Pharmaceutical Preparations
DBVT,DBV Technologies S.A. American Depositary Shares,$2.87,-0.01,-0.347%,315184473.00,France,2014,55321,Health Care,Biotechnology: Pharmaceutical Preparations
DBX,Dropbox Inc. Class A Common Stock,$24.755,0.135,0.548%,9468045246.00,United States,2018,1098010,Technology,Computer Software: Prepackaged Software
DCBO,Docebo Inc. Common Shares,$67.98,-1.41,-2.032%,2228675082.00,Canada,,36280,,
DCGO,DocGo Inc. Common Stock,$9.00,0.14,1.58%,900624942.00,United States,2020,179667,Health Care,Managed Health Care
DCGOW,DocGo Inc. Warrants,$1.9501,0.0201,1.041%,0.00,United States,2020,2961,Health Care,Managed Health Care
DCOM,Dime Community Bancshares Inc. Common Stock,$34.22,-0.38,-1.098%,1384350868.00,United States,,49727,Finance,Savings Institutions
DCOMP,Dime Community Bancshares Inc. Fixed-Rate Non-Cumulative Perpetual Preferred Stock Series A,$25.85,0.07,0.272%,0.00,United States,,21367,Finance,Savings Institutions
DCPH,Deciphera Pharmaceuticals Inc. Common Stock,$8.57,0.27,3.253%,501180773.00,United States,2017,354329,Health Care,Biotechnology: Pharmaceutical Preparations
DCRC,Decarbonization Plus Acquisition Corporation III Class A Common Stock,$12.74,0.74,6.167%,557375000.00,United States,2021,1025848,,
DCRCU,Decarbonization Plus Acquisition Corporation III Unit,$13.21,-0.12,-0.90%,0.00,United States,2021,582,,
DCRCW,Decarbonization Plus Acquisition Corporation III Warrant,$4.3999,0.5299,13.693%,0.00,United States,2021,54387,,
DCRD,Decarbonization Plus Acquisition Corporation IV Class A Ordinary Share,$9.91,0.00,0.00%,391754688.00,United States,2021,105,,
DCRDU,Decarbonization Plus Acquisition Corporation IV Unit,$10.365,-0.005,-0.048%,0.00,United States,2021,1292,,
DCRDW,Decarbonization Plus Acquisition Corporation IV Warrant,$0.9801,-0.0176,-1.764%,0.00,United States,2021,14091,,
DCRN,Decarbonization Plus Acquisition Corporation II Class A Common stock,$10.00,0.04,0.402%,503125000.00,United States,2021,191593,,
DCRNU,Decarbonization Plus Acquisition Corporation II Unit,$10.63,0.00,0.00%,0.00,United States,2021,1,,
DCRNW,Decarbonization Plus Acquisition Corporation II Warrant,$1.99,0.00,0.00%,0.00,United States,2021,22790,,
DCT,Duck Creek Technologies Inc. Common Stock,$29.35,-0.09,-0.306%,3875567064.00,United States,2020,234442,Technology,Retail: Computer Software & Peripheral Equipment
DCTH,Delcath Systems Inc. Common Stock,$8.6066,0.1566,1.853%,63312637.00,United States,,129191,Health Care,Medical Specialities
DDI,DoubleDown Interactive Co. Ltd. American Depository Shares,$15.41,-0.06,-0.388%,763618510.00,South Korea,2021,7744,Technology,EDP Services
DDOG,Datadog Inc. Class A Common Stock,$181.33,4.32,2.441%,56577928009.00,United States,2019,1475057,Technology,EDP Services
DENN,Denny's Corporation Common Stock,$15.455,0.455,3.033%,979631573.00,United States,,177593,Consumer Services,Restaurants
DERM,Journey Medical Corporation Common Stock,$7.25,-0.02,-0.275%,119199019.00,United States,2021,38247,Health Care,Biotechnology: Pharmaceutical Preparations
DFFN,Diffusion Pharmaceuticals Inc. Common Stock,$0.3996,0.0106,2.725%,40727363.00,United States,,604537,Health Care,Biotechnology: Pharmaceutical Preparations
DFH,Dream Finders Homes Inc. Class A Common Stock,$18.75,0.12,0.644%,1734777788.00,United States,2021,34812,,
DGHI,Digihost Technology Inc. Common Subordinate Voting Shares,$4.76,0.04,0.847%,119140944.00,Canada,,47919,,
DGICA,Donegal Group Inc. Class A Common Stock,$14.10,0.04,0.284%,441743793.00,United States,,14253,Finance,Property-Casualty Insurers
DGICB,Donegal Group Inc. Class B Common Stock,$13.92,-0.11,-0.784%,436104510.00,United States,1986,450,Finance,Property-Casualty Insurers
DGII,Digi International Inc. Common Stock,$23.55,0.10,0.426%,810242484.00,United States,1989,12628,Technology,Computer peripheral equipment
DGLY,Digital Ally Inc. Common Stock,$1.16,0.03,2.655%,61135419.00,United States,,683750,Miscellaneous,Diversified Manufacture
DGNS,Dragoneer Growth Opportunities Corp. II Class A Ordinary Shares,$10.12,0.15,1.505%,356750240.00,United States,2020,121643,Finance,Business Services
DGNU,Dragoneer Growth Opportunities Corp. III Class A Ordinary Shares,$10.0001,0.00,0.00%,538350463.00,United States,2021,1,Finance,Business Services
DH,Definitive Healthcare Corp. Class A Common Stock,$31.83,1.53,5.05%,3159551889.00,United States,2021,309089,Technology,Computer Software: Prepackaged Software
DHACU,Digital Health Acquisition Corp. Unit,$10.2173,0.0773,0.762%,0.00,United States,2021,500,,
DHBC,DHB Capital Corp. Class A common stock,$9.79,0.025,0.256%,351828125.00,United States,2021,1066,,
DHBCU,DHB Capital Corp. Unit,$9.93,0.02,0.202%,356859375.00,United States,2021,1400,,
DHBCW,DHB Capital Corp. Warrant,$0.62,0.00,0.00%,0.00,United States,2021,1,,
DHC,Diversified Healthcare Trust Common Shares of Beneficial Interest,$2.87,0.04,1.413%,685915346.00,United States,,309818,Consumer Services,Real Estate Investment Trusts
DHCA,DHC Acquisition Corp. Class A ordinary share,$9.80,0.00,0.00%,379077132.00,United States,2021,2,Finance,Business Services
DHCAU,DHC Acquisition Corp. Unit,$10.05,0.05,0.50%,0.00,United States,2021,1760,Finance,Business Services
DHCAW,DHC Acquisition Corp. Warrant,$0.75,0.0499,7.128%,0.00,United States,2021,1317,Finance,Business Services
DHCNI,Diversified Healthcare Trust 5.625% Senior Notes due 2042,$23.15,0.09,0.39%,0.00,United States,,16283,Consumer Services,Real Estate Investment Trusts
DHCNL,Diversified Healthcare Trust 6.25% Senior Notes Due 2046,$23.6483,-0.1457,-0.612%,0.00,United States,,2324,Consumer Services,Real Estate Investment Trusts
DHHC,DiamondHead Holdings Corp. Class A Common Stock,$9.75,-0.04,-0.409%,420468750.00,United States,2021,2990,,
DHHCU,DiamondHead Holdings Corp. Unit,$9.91,-0.05,-0.502%,0.00,United States,2021,2500,,
DHHCW,DiamondHead Holdings Corp. Warrant,$0.6403,-0.0197,-2.985%,0.00,United States,2021,11275,,
DHIL,Diamond Hill Investment Group Inc. Class A Common Stock,$200.39,1.39,0.698%,635575961.00,United States,,3607,Finance,Investment Managers
DIBS,1stdibs.com Inc. Common Stock,$13.45,-0.14,-1.03%,509429510.00,United States,2021,213436,Miscellaneous,Diversified Commercial Services
DICE,DICE Therapeutics Inc. Common Stock,$28.31,0.45,1.615%,1082331359.00,United States,2021,144815,Health Care,Biotechnology: Pharmaceutical Preparations
DILAW,DILA Capital Acquisition Corp. Warrant,$0.5858,0.00,0.00%,0.00,Mexico,2021,100,,
DIOD,Diodes Incorporated Common Stock,$110.77,-0.74,-0.664%,4986617829.00,United States,,100651,Technology,Semiconductors
DISA,Disruptive Acquisition Corporation I Class A Ordinary Shares,$9.84,0.03,0.306%,338250000.00,United States,2021,198264,Finance,Business Services
DISAW,Disruptive Acquisition Corporation I Warrant,$0.70,0.00,0.00%,0.00,United States,2021,100,Finance,Business Services
DISCA,Discovery Inc. Series A Common Stock,$24.40,0.18,0.743%,12343127716.00,United States,,2389200,Consumer Services,Television Services
DISCB,Discovery Inc. Series B Common Stock,$35.85,0.00,0.00%,18135292157.00,United States,,287,Consumer Services,Television Services
DISCK,Discovery Inc. Series C Common Stock,$23.55,0.16,0.684%,11913141710.00,United States,,1819475,Consumer Services,Television Services
DISH,DISH Network Corporation Class A Common Stock,$32.18,0.05,0.156%,17016835971.00,United States,1995,850797,Consumer Services,Television Services
DJCO,Daily Journal Corp. (S.C.) Common Stock,$350.50,0.30,0.086%,483951473.00,United States,,1905,Consumer Services,Newspapers/Magazines
DKDCA,Data Knights Acquisition Corp. Class A Common Stock,$10.07,-0.0023,-0.023%,150649969.00,United Kingdom,2021,900,,
DKDCW,Data Knights Acquisition Corp. Warrant,$0.429,-0.0002,-0.047%,0.00,United Kingdom,2021,7803,,
DKNG,DraftKings Inc. Class A Common Stock,$33.485,2.215,7.083%,13612543502.00,United States,2019,8068436,Consumer Services,Services-Misc. Amusement & Recreation
DLCA,Deep Lake Capital Acquisition Corp. Class A Ordinary Shares,$9.78,0.00,0.00%,253057500.00,United States,2021,25101,Finance,Business Services
DLCAU,Deep Lake Capital Acquisition Corp. Unit,$10.10,0.00,0.00%,0.00,United States,2021,2150,Finance,Business Services
DLCAW,Deep Lake Capital Acquisition Corp. Warrant,$0.77,0.0099,1.302%,0.00,United States,2021,850,Finance,Business Services
DLHC,DLH Holdings Corp.,$13.79,0.29,2.148%,172994254.00,United States,,17072,Miscellaneous,Business Services
DLO,DLocal Limited Class A Common Shares,$36.48,0.56,1.559%,10762637528.00,Uruguay,2021,535916,,
DLPN,Dolphin Entertainment Inc. Common Stock,$8.57,0.02,0.234%,68056375.00,United States,,18318,,
DLTH,Duluth Holdings Inc. Class B Common Stock,$16.265,0.335,2.103%,537761855.00,United States,2015,51451,Consumer Services,Department/Specialty Retail Stores
DLTR,Dollar Tree Inc. Common Stock,$137.18,-0.80,-0.58%,30859472174.00,United States,1995,720901,Consumer Services,Department/Specialty Retail Stores
DMAC,DiaMedica Therapeutics Inc. Common Stock,$3.905,0.135,3.581%,103245142.00,United States,2018,41522,,
DMAQ,Deep Medicine Acquisition Corp. Class A Common Stock,$9.84,-0.01,-0.102%,161702688.00,United States,2021,107,,
DMAQR,Deep Medicine Acquisition Corp. Rights,$0.32,0.01,3.226%,0.00,United States,2021,149400,,
DMLP,Dorchester Minerals L.P. Common Units Representing Limited Partnership Interests,$18.56,-0.02,-0.108%,657112605.00,United States,,34029,Energy,Oil & Gas Production
DMRC,Digimarc Corporation Common Stock,$44.955,0.835,1.893%,761161517.00,United States,,18202,Technology,EDP Services
DMTK,DermTech Inc. Common Stock,$18.34,-0.10,-0.542%,545013411.00,United States,2017,203983,Health Care,Managed Health Care
DNAA,Social Capital Suvretta Holdings Corp. I Class A Ordinary Share,$9.94,0.015,0.151%,316986600.00,United States,2021,521,,
DNAB,Social Capital Suvretta Holdings Corp. II Class A Ordinary Shares,$9.8702,-0.0198,-0.20%,314760678.00,United States,2021,954,,
DNAC,Social Capital Suvretta Holdings Corp. III Class A ordinary shares,$9.90,0.0102,0.103%,315711000.00,United States,2021,2508,,
DNAD,Social Capital Suvretta Holdings Corp. IV Class A Ordinary Shares,$9.8603,-0.0197,-0.199%,314444967.00,United States,2021,3824,Health Care,Biotechnology: Pharmaceutical Preparations
DNAY,Codex DNA Inc. Common Stock,$7.228,0.318,4.602%,211832434.00,United States,2021,12407,Health Care,Medical Specialities
DNLI,Denali Therapeutics Inc. Common Stock,$45.96,1.59,3.584%,5612891703.00,United States,2017,130297,Health Care,Biotechnology: Biological Products (No Diagnostic Substances)
DNUT,Krispy Kreme Inc. Common Stock,$16.09,0.29,1.835%,2691064326.00,United States,2021,796289,Consumer Services,Specialty Foods
DOCU,DocuSign Inc. Common Stock,$152.4989,13.8989,10.028%,30175952093.00,United States,2018,12161336,Technology,EDP Services
DOGZ,Dogness (International) Corporation Class A Common Stock,$5.10,-0.15,-2.857%,162194963.00,China,2017,300622,Consumer Durables,Miscellaneous manufacturing industries
DOMO,Domo Inc. Class B Common Stock,$51.76,-0.04,-0.077%,1664552739.00,United States,2018,233223,Technology,Computer Software: Prepackaged Software
DOOO,BRP Inc. (Recreational Products) Common Subordinate Voting Shares,$81.155,-3.255,-3.856%,6655084530.00,Canada,,40584,,
DORM,Dorman Products Inc. Common Stock,$112.835,-0.075,-0.066%,3568266395.00,United States,,20870,Capital Goods,Auto Parts:O.E.M.
DOX,Amdocs Limited Ordinary Shares,$71.21,0.44,0.622%,9015542050.00,Guernsey,,156459,Technology,EDP Services
DOYU,DouYu International Holdings Limited ADS,$2.655,0.145,5.777%,861307992.00,China,2019,1148684,Technology,Computer Software: Programming Data Processing
DPCSU,DP Cap Acquisition Corp I Unit,$10.20,0.00,0.00%,0.00,United States,2021,135,,
DPRO,Draganfly Inc. Common Shares,$2.4987,-0.0413,-1.626%,80350571.00,Canada,,122721,Consumer Durables,Electronic Components
DRAY,Macondray Capital Acquisition Corp. I Class A Ordinary Shares,$9.86,0.02,0.203%,354343750.00,United States,2021,208,,
DRAYU,Macondray Capital Acquisition Corp. I Unit,$9.995,0.075,0.756%,0.00,United States,2021,1003,,
DRAYW,Macondray Capital Acquisition Corp. I Warrant,$0.6001,0.0001,0.017%,0.00,United States,2021,600,,
DRIO,DarioHealth Corp. Common Stock,$14.37,-0.05,-0.347%,238191846.00,Israel,,62917,Health Care,Medical/Dental Instruments
DRMA,Dermata Therapeutics Inc. Common Stock,$2.4859,-0.0541,-2.13%,20704139.00,United States,2021,68464,Health Care,Biotechnology: Pharmaceutical Preparations
DRMAW,Dermata Therapeutics Inc. Warrant,$0.63,-0.0389,-5.816%,0.00,United States,2021,6990,Health Care,Biotechnology: Pharmaceutical Preparations
DRNA,Dicerna Pharmaceuticals Inc. Common Stock,$38.0325,-0.1275,-0.334%,2963093477.00,United States,2014,1209344,Health Care,Biotechnology: Commercial Physical & Biological Resarch
DRRX,DURECT Corporation Common Stock,$1.09,0.09,9.00%,247981334.00,United States,2000,499607,Health Care,Biotechnology: Pharmaceutical Preparations
DRTT,DIRTT Environmental Solutions Ltd. Common Shares,$2.14,-0.01,-0.465%,182615948.00,Canada,,8645,,
DRUG,Bright Minds Biosciences Inc. Common Stock,$3.89,-0.07,-1.768%,46035664.00,Canada,,6209,,
DRVN,Driven Brands Holdings Inc. Common Stock,$32.43,0.00,0.00%,5428126428.00,United States,2021,88903,,
DSAC,Duddell Street Acquisition Corp. Class A Ordinary Shares,$9.90,-0.0001,-0.001%,216562500.00,Hong Kong,2020,16133,Finance,Business Services
DSACW,Duddell Street Acquisition Corp. Warrant,$1.40,0.00,0.00%,0.00,Hong Kong,2020,2763,Finance,Business Services
DSEY,Diversey Holdings Ltd. Ordinary Shares,$13.81,0.10,0.729%,4383724043.00,United States,2021,117888,Consumer Durables,Specialty Chemicals
DSGN,Design Therapeutics Inc. Common Stock,$19.00,-0.71,-3.602%,1057587519.00,United States,2021,92503,Health Care,Biotechnology: Pharmaceutical Preparations
DSGX,Descartes Systems Group Inc. (The) Common Stock,$79.29,0.21,0.266%,6712501342.00,Canada,,59718,,
DSKE,Daseke Inc. Common Stock,$10.10,0.30,3.061%,631141657.00,United States,2015,114980,,
DSKEW,Daseke Inc. Warrant,$0.155,0.005,3.333%,0.00,United States,2015,17655,,
DSP,Viant Technology Inc. Class A Common Stock,$9.985,-0.015,-0.15%,134623262.00,United States,2021,266842,Technology,EDP Services
DSWL,Deswell Industries Inc. Common Shares,$4.04,-0.11,-2.651%,64378366.00,Macau,1995,3742,Consumer Non-Durables,Plastic Products
DTEA,DAVIDsTEA Inc. Common Stock,$3.64,0.03,0.831%,95950287.00,Canada,2015,14228,,
DTIL,Precision BioSciences Inc. Common Stock,$9.05,0.18,2.029%,549944128.00,United States,2019,128122,Health Care,Biotechnology: Pharmaceutical Preparations
DTOC,Digital Transformation Opportunities Corp. Class A Common Stock,$9.73,0.00,0.00%,405619375.00,United States,2021,729220,,
DTOCU,Digital Transformation Opportunities Corp. Units,$9.90,0.00,0.00%,0.00,United States,2021,30,,
DTOCW,Digital Transformation Opportunities Corp. Warrant,$0.6799,0.0008,0.118%,0.00,United States,2021,6299,,
DTRT,DTRT Health Acquisition Corp. Class A Common Stock,$9.94,0.00,0.00%,285775000.00,United States,2021,5,,
DTRTW,DTRT Health Acquisition Corp. Warrant,$0.528,0.0104,2.009%,0.00,United States,2021,200,,
DTSS,Datasea Inc. Common Stock,$1.44,0.06,4.348%,34547478.00,China,,88171,Technology,Retail: Computer Software & Peripheral Equipment
DTST,Data Storage Corporation Common Stock,$3.36,0.17,5.329%,22487613.00,United States,,37425,Technology,EDP Services
DTSTW,Data Storage Corporation Warrant,$0.865,-0.015,-1.705%,0.00,United States,,300,Technology,EDP Services
DUNE,Dune Acquisition Corporation Class A Common Stock,$9.90,-0.02,-0.202%,213468750.00,United States,2021,1134,,
DUNEU,Dune Acquisition Corporation Unit,$10.21,0.06,0.591%,0.00,United States,2020,325,,
DUNEW,Dune Acquisition Corporation Warrant,$0.6301,-0.0199,-3.062%,0.00,United States,2021,73007,,
DUO,Fangdd Network Group Ltd. American Depositary Shares,$0.598,0.0125,2.135%,47748364.00,China,2019,156429,Technology,Computer Software: Programming Data Processing
DUOL,Duolingo Inc. Class A Common Stock,$110.01,0.04,0.036%,4122328933.00,United States,2021,189474,Technology,Computer Software: Prepackaged Software
DUOT,Duos Technologies Group Inc. Common Stock,$4.3138,-0.0362,-0.832%,15576273.00,United States,,4356,Technology,Computer Software: Prepackaged Software
DVAX,Dynavax Technologies Corporation Common Stock,$14.479,0.029,0.201%,1736786919.00,United States,2004,524681,Health Care,Biotechnology: Pharmaceutical Preparations
DWAC,Digital World Acquisition Corp. Class A Common Stock,$59.795,8.725,17.084%,2225255020.00,United States,2021,17311900,,
DWACU,Digital World Acquisition Corp. Units,$68.34,8.98,15.128%,0.00,United States,2021,41504,,
DWACW,Digital World Acquisition Corp. Warrants,$18.42,1.94,11.772%,0.00,United States,2021,2120974,,
DWSN,Dawson Geophysical Company Common Stock,$2.33,0.01,0.431%,55090366.00,United States,,1238,Energy,Oil & Gas Production
DXCM,DexCom Inc. Common Stock,$563.90,5.50,0.985%,54654334973.00,United States,2005,318445,Health Care,Medical Specialities
DXLG,Destination XL Group Inc. Common Stock,$6.92,0.03,0.435%,437717998.00,United States,,242699,Consumer Services,Clothing/Shoe/Accessory Stores
DXPE,DXP Enterprises Inc. Common Stock,$27.925,0.085,0.305%,518590707.00,United States,,28015,Capital Goods,Industrial Machinery/Components
DXYN,Dixie Group Inc. (The) Common Stock,$6.145,0.105,1.738%,97076387.00,United States,,16295,Consumer Durables,Home Furnishings
DYAI,Dyadic International Inc. Common Stock,$3.9376,0.0676,1.747%,110564489.00,United States,,69802,Health Care,Biotechnology: Biological Products (No Diagnostic Substances)
DYN,Dyne Therapeutics Inc. Common Stock,$13.81,0.34,2.524%,711608157.00,United States,2020,43306,Consumer Durables,Specialty Chemicals
DYNS,Dynamics Special Purpose Corp. Class A Common Stock,$10.15,0.23,2.319%,299074825.00,United States,2021,12301,,
DYNT,Dynatronics Corporation Common Stock,$1.14,0.05,4.587%,20214982.00,United States,,81914,Health Care,Medical/Dental Instruments
DZSI,DZS Inc. Common Stock,$14.045,-0.035,-0.249%,382565716.00,United States,,18590,Public Utilities,Telecommunications Equipment
EA,Electronic Arts Inc. Common Stock,$126.74,0.59,0.468%,35843104044.00,United States,,1151630,Technology,Computer Software: Prepackaged Software
EAC,Edify Acquisition Corp. Class A Common Stock,$9.77,-0.01,-0.102%,337065000.00,United States,2021,518,,
EACPU,Edify Acquisition Corp. Units,$9.9501,0.00,0.00%,0.00,United States,2021,15,,
EACPW,Edify Acquisition Corp. Warrant,$0.55,0.0053,0.973%,0.00,United States,2021,100,,
EAR,Eargo Inc. Common Stock,$5.59,0.12,2.194%,219479538.00,United States,2020,814004,Health Care,Medical Specialities
EAST,Eastside Distilling Inc. Common Stock,$2.05,0.15,7.895%,31827913.00,United States,,28556,Consumer Non-Durables,Beverages (Production/Distribution)
EBACW,European Biotech Acquisition Corp. Warrant,$0.638,-0.027,-4.06%,0.00,Netherlands,2021,1434,Finance,Business Services
EBAY,eBay Inc. Common Stock,$66.46,-0.77,-1.145%,41604211285.00,United States,1998,2493846,Consumer Services,Catalog/Specialty Distribution
EBC,Eastern Bankshares Inc. Common Stock,$20.65,0.11,0.536%,3856555880.00,United States,2020,240701,Finance,Major Banks
EBET,Esports Technologies Inc. Common Stock,$25.00,1.00,4.167%,339670950.00,United States,2021,25111,Consumer Services,Services-Misc. Amusement & Recreation
EBIX,Ebix Inc. Common Stock,$32.54,-0.36,-1.094%,1006899505.00,United States,,50155,Technology,EDP Services
EBMT,Eagle Bancorp Montana Inc. Common Stock,$22.70,0.00,0.00%,153831158.00,United States,,146,Finance,Savings Institutions
EBON,Ebang International Holdings Inc. Class A Ordinary Shares,$1.4322,0.0122,0.859%,266153370.00,China,2020,797948,Technology,Semiconductors
EBTC,Enterprise Bancorp Inc Common Stock,$39.25,-0.39,-0.984%,472067011.00,United States,,6736,Finance,Major Banks
ECOL,US Ecology Inc Common Stock,$36.11,-0.04,-0.111%,1137910020.00,United States,,44629,Public Utilities,Environmental Services
ECOLW,US Ecology Inc. Warrant,$6.16,0.00,0.00%,0.00,United States,,5798,Public Utilities,Environmental Services
ECOR,electroCore Inc. Common Stock,$0.7575,0.0821,12.156%,53553493.00,United States,2018,492867,Health Care,Biotechnology: Electromedical & Electrotherapeutic Apparatus
ECPG,Encore Capital Group Inc Common Stock,$56.64,-0.44,-0.771%,1657950787.00,United States,,75584,,
EDAP,EDAP TMS S.A. American Depositary Shares,$5.45,-0.03,-0.547%,181736441.00,France,1997,26435,Health Care,Biotechnology: Electromedical & Electrotherapeutic Apparatus
EDIT,Editas Medicine Inc. Common Stock,$31.96,0.99,3.197%,2186017338.00,United States,2016,460011,Health Care,Biotechnology: Pharmaceutical Preparations
EDNC,Endurance Acquisition Corp. Class A Ordinary Shares,$9.75,-0.03,-0.307%,251062500.00,United States,2021,60136,,
EDNCU,Endurance Acquisition Corp. Unit,$10.00,0.07,0.705%,0.00,United States,2021,27398,,
EDNCW,Endurance Acquisition Corp. Warrant,$0.508,0.0031,0.614%,0.00,United States,2021,100,,
EDRY,EuroDry Ltd. Common Shares ,$21.58,0.74,3.551%,49733915.00,Greece,,28265,Consumer Services,Marine Transportation
EDSA,Edesa Biotech Inc. Common Shares,$5.92,0.26,4.594%,78708786.00,United States,,73591,,
EDTK,Skillful Craftsman Education Technology Limited Ordinary Share,$1.07,0.03,2.885%,15943000.00,China,2020,417757,Consumer Services,Other Consumer Services
EDTX,EdtechX Holdings Acquisition Corp. II Class A common stock,$10.00,0.00,0.00%,143750000.00,United Kingdom,2021,3021,,
EDTXU,EdtechX Holdings Acquisition Corp. II Unit,$10.19,-0.02,-0.196%,146481250.00,United Kingdom,2020,2992,,
EDTXW,EdtechX Holdings Acquisition Corp. II Warrant,$0.501,-0.009,-1.765%,0.00,United Kingdom,2021,11118,,
EDUC,Educational Development Corporation Common Stock,$8.35,-0.18,-2.11%,72278736.00,United States,,4738,Consumer Services,Books
EEFT,Euronet Worldwide Inc. Common Stock,$120.99,4.91,4.23%,6395050223.00,United States,1997,293948,Technology,EDP Services
EEIQ,Elite Education Group International Ltd. Common Stock,$3.52,0.08,2.326%,31087647.00,United States,2021,20610,Consumer Services,Other Consumer Services
EFOI,Energy Focus Inc. Common Stock,$3.335,1.385,71.026%,16967059.00,United States,,163457954,Consumer Durables,Building Products
EFSC,Enterprise Financial Services Corporation Common Stock,$48.79,0.32,0.66%,1872181443.00,United States,,69782,Finance,Major Banks
EFSCP,Enterprise Financial Services Corporation Depositary Shares Each Representing a 1/40th Interest in a Share of 5% Fixed Rate Non-Cumulative Perpetual Preferred Stock Series A,$25.00,-0.27,-1.068%,0.00,United States,,22367,Finance,Major Banks
EFTR,eFFECTOR Therapeutics Inc. Common Stock,$7.22,0.17,2.411%,291483862.00,United States,2021,77728,Health Care,Biotechnology: Pharmaceutical Preparations
EFTRW,eFFECTOR Therapeutics Inc. Warrant,$0.89,0.07,8.537%,0.00,United States,2021,100,Health Care,Biotechnology: Pharmaceutical Preparations
EGAN,eGain Corporation Common Stock,$10.68,0.20,1.908%,335227044.00,United States,1999,19691,Technology,Computer Software: Prepackaged Software
EGBN,Eagle Bancorp Inc. Common Stock,$56.32,-0.05,-0.089%,1799437798.00,United States,,27663,Finance,Major Banks
EGLE,Eagle Bulk Shipping Inc. Common Stock,$43.215,0.805,1.898%,587333380.00,United States,,94635,Transportation,Marine Transportation
EGLX,Enthusiast Gaming Holdings Inc. Common Stock,$3.5899,-0.0601,-1.647%,479556957.00,Canada,,170850,,
EGRX,Eagle Pharmaceuticals Inc. Common Stock,$46.56,-1.06,-2.226%,601270206.00,United States,2014,17417,Health Care,Biotechnology: Pharmaceutical Preparations
EH,EHang Holdings Limited ADS,$17.80,0.58,3.368%,986636787.00,China,2019,391084,Transportation,Air Freight/Delivery Services
EHTH,eHealth Inc. Common Stock,$26.59,0.81,3.142%,701659898.00,United States,2006,216937,Finance,Specialty Insurers
