Symbol,Name,Last Sale,Net Change,% Change,Market Cap,Country,IPO Year,Volume,Sector,Industry
JUPWW,Jupiter Wellness Inc. Warrant,$1.7709,0.1709,10.681%,0.00,United States,2020,703,Health Care,Biotechnology: Pharmaceutical Preparations
JVA,Coffee Holding Co. Inc. Common Stock,$4.4478,0.0578,1.317%,25390707.00,United States,2005,8328,Consumer Non-Durables,Specialty Foods
JWACU,Jupiter Wellness Acquisition Corp. Unit,$10.03,0.01,0.10%,0.00,United States,2021,312976,,
JWEL,Jowell Global Ltd. Ordinary Shares,$17.1797,2.2497,15.068%,437581630.00,China,2021,342265,Consumer Services,Other Consumer Services
JYAC,Jiya Acquisition Corp. Class A Common Stock,$9.76,-0.01,-0.102%,131243608.00,United States,2020,196,,
JYNT,The Joint Corp. Common Stock,$73.37,0.30,0.411%,1057506682.00,United States,2014,56444,,
JZXN,Jiuzi Holdings Inc. Ordinary Shares,$1.7831,-0.0169,-0.939%,38206206.00,China,2021,840918,Consumer Durables,Automotive Aftermarket
KAII,Kismet Acquisition Two Corp. Class A Ordinary Shares,$9.74,0.00,0.00%,284895000.00,United States,2021,4110,Finance,Business Services
KAIIU,Kismet Acquisition Two Corp. Unit,$9.885,0.00,0.00%,0.00,United States,2021,25,Finance,Business Services
KAIIW,Kismet Acquisition Two Corp. Warrant,$0.6164,0.0664,12.073%,0.00,United States,2021,6736,Finance,Business Services
KAIR,Kairos Acquisition Corp. Class A Ordinary Shares,$9.79,0.00,0.00%,337755000.00,United States,2021,80,Finance,Business Services
KAIRU,Kairos Acquisition Corp. Unit,$10.05,0.05,0.50%,0.00,United States,2021,5900,Finance,Business Services
KAIRW,Kairos Acquisition Corp. Warrant,$0.5919,0.03,5.339%,0.00,United States,2021,100,Finance,Business Services
KALA,Kala Pharmaceuticals Inc. Common Stock,$1.72,0.02,1.176%,96422968.00,United States,2017,230868,Health Care,Biotechnology: Pharmaceutical Preparations
KALU,Kaiser Aluminum Corporation Common Stock,$97.365,2.545,2.684%,1544469059.00,United States,,31571,Basic Industries,Aluminum
KALV,KalVista Pharmaceuticals Inc. Common Stock,$13.44,0.25,1.895%,328444919.00,United Kingdom,2015,36421,Health Care,Biotechnology: Pharmaceutical Preparations
KARO,Karooooo Ltd. Ordinary Shares,$34.50,0.4457,1.309%,1067813157.00,Singapore,2021,15452,Technology,Computer Software: Prepackaged Software
KAVL,Kaival Brands Innovations Group Inc. Common Stock,$1.10,0.05,4.762%,31161006.00,United States,,175227,Consumer Non-Durables,Farming/Seeds/Milling
KBAL,Kimball International Inc. Class B Common Stock,$10.49,-0.07,-0.663%,383575997.00,United States,,28501,Consumer Durables,Industrial Specialties
KBNT,Kubient Inc. Common Stock,$3.075,0.105,3.535%,43827624.00,United States,2020,34780,Technology,EDP Services
KBNTW,Kubient Inc. Warrant,$1.00,0.1687,20.294%,0.00,United States,2020,4000,Technology,EDP Services
KC,Kingsoft Cloud Holdings Limited American Depositary Shares,$16.82,0.46,2.812%,4064874817.00,China,2020,723643,Technology,Computer Software: Prepackaged Software
KDNY,Chinook Therapeutics Inc. Common Stock,$15.95,-0.10,-0.623%,871049709.00,United States,2015,65205,Health Care,Biotechnology: Pharmaceutical Preparations
KDP,Keurig Dr Pepper Inc. Common Stock,$34.5045,-0.4255,-1.218%,48926055820.00,United States,,2120585,Consumer Non-Durables,Beverages (Production/Distribution)
KE,Kimball Electronics Inc. Common Stock,$21.35,0.33,1.57%,535904450.00,United States,,57913,Capital Goods,Industrial Machinery/Components
KELYA,Kelly Services Inc. Class A Common Stock,$17.3144,-0.2356,-1.342%,682004520.00,United States,,45188,Technology,Diversified Commercial Services
KELYB,Kelly Services Inc. Class B Common Stock,$17.50,0.24,1.39%,689315200.00,United States,,555,Technology,Diversified Commercial Services
KEQU,Kewaunee Scientific Corporation Common Stock,$12.15,-0.09,-0.735%,33896957.00,United States,,120,Capital Goods,Medical Specialities
KERN,Akerna Corp. Common Stock,$2.32,0.08,3.571%,32616200.00,United States,2018,333782,Health Care,Managed Health Care
KERNW,Akerna Corp Warrant,$0.39,0.00,0.00%,0.00,United States,2018,1829,Health Care,Managed Health Care
KFFB,Kentucky First Federal Bancorp Common Stock,$7.25,-0.07,-0.956%,59575983.00,United States,,408,Finance,Savings Institutions
KFRC,Kforce Inc. Common Stock,$74.43,0.81,1.10%,1594598666.00,United States,1995,23845,Technology,Diversified Commercial Services
KHC,The Kraft Heinz Company Common Stock,$33.3562,-1.1538,-3.343%,40829405138.00,United States,,7078471,Consumer Non-Durables,Farming/Seeds/Milling
KIDS,OrthoPediatrics Corp. Common Stock,$59.8385,-1.5715,-2.559%,1177524742.00,United States,2017,20364,Health Care,Medical/Dental Instruments
KIIIU,Kismet Acquisition Three Corp. Unit,$9.9101,0.0001,0.001%,0.00,United States,2021,1000,Finance,Business Services
KIIIW,Kismet Acquisition Three Corp. Warrant,$0.5497,0.0197,3.717%,0.00,United States,2021,500,Finance,Business Services
KINS,Kingstone Companies Inc. Common Stock,$4.93,0.03,0.612%,51681841.00,United States,,2892,Finance,Specialty Insurers
KINZ,KINS Technology Group Inc. Class A Common Stock,$9.98,0.00,0.00%,344310000.00,United States,2021,4,,
KINZU,KINS Technology Group Inc. Unit,$10.26,0.00,0.00%,0.00,United States,2020,4,,
KINZW,KINS Technology Group Inc. Warrant,$0.6211,-0.0039,-0.624%,0.00,United States,2021,4322,,
KIRK,Kirkland's Inc. COMMONSTOCK,$15.8105,0.3105,2.003%,213073887.00,United States,2002,190092,Miscellaneous,Diversified Commercial Services
KLAC,KLA Corporation Common Stock,$419.415,0.265,0.063%,63592610333.00,United States,1980,317133,Capital Goods,Electronic Components
KLAQ,KL Acquisition Corp Class A Common Stock,$9.78,-0.01,-0.102%,351468750.00,United States,2021,540,,
KLAQU,KL Acquisition Corp Unit,$9.95,0.00,0.00%,0.00,United States,2021,15,,
KLDO,Kaleido Biosciences Inc. Common Stock,$3.56,-0.04,-1.111%,151635886.00,United States,2019,60195,Health Care,Biotechnology: Biological Products (No Diagnostic Substances)
KLIC,Kulicke and Soffa Industries Inc. Common Stock,$67.79,2.67,4.10%,4231529284.00,Singapore,,1106047,Technology,Semiconductors
KLTR,Kaltura Inc. Common Stock,$4.39,-0.18,-3.939%,556978805.00,United States,2021,118324,Technology,EDP Services
KLXE,KLX Energy Services Holdings Inc. Common Stock,$4.05,0.09,2.273%,35963498.00,United States,,142234,Energy,Oilfield Services/Equipment
KMDA,Kamada Ltd. Ordinary Shares,$6.5968,0.2168,3.398%,295446336.00,Israel,2013,61599,Health Care,Biotechnology: Pharmaceutical Preparations
KMPH,KemPharm Inc. Common Stock,$8.64,0.18,2.128%,305159841.00,United States,,117757,Health Care,Biotechnology: Pharmaceutical Preparations
KNBE,KnowBe4 Inc. Class A Common Stock,$23.825,0.245,1.039%,4083932046.00,United States,2021,319118,Technology,Computer Software: Prepackaged Software
KNDI,Kandi Technologies Group Inc Common Stock,$3.85,0.09,2.394%,297932751.00,China,,577482,Capital Goods,Auto Parts:O.E.M.
KNSA,Kiniksa Pharmaceuticals Ltd. Class A Common Stock,$13.50,0.12,0.897%,929993873.00,United States,2018,112162,Health Care,Biotechnology: Pharmaceutical Preparations
KNSL,Kinsale Capital Group Inc. Common Stock,$213.245,-1.335,-0.622%,4866004602.00,United States,2016,39067,Finance,Property-Casualty Insurers
KNTE,Kinnate Biopharma Inc. Common Stock,$19.705,-0.065,-0.329%,861031552.00,United States,2020,10499,Health Care,Biotechnology: Pharmaceutical Preparations
KOD,Kodiak Sciences Inc Common Stock,$89.10,-0.90,-1.00%,4608010183.00,United States,2018,65909,Health Care,Biotechnology: Pharmaceutical Preparations
KOPN,Kopin Corporation Common Stock,$5.045,0.085,1.714%,465099589.00,United States,1992,834785,Capital Goods,Industrial Machinery/Components
KOR,Corvus Gold Inc. Common Shares,$3.22,0.00,0.00%,408951173.00,Canada,,11538,,
KOSS,Koss Corporation Common Stock,$13.87,0.51,3.817%,126741217.00,United States,,28616,Consumer Non-Durables,Consumer Electronics/Appliances
KPLT,Katapult Holdings Inc. Common Stock,$3.62,0.35,10.703%,352849983.00,United States,2019,2562924,Technology,EDP Services
KPLTW,Katapult Holdings Inc. Warrant,$0.751,0.021,2.877%,0.00,United States,2019,40470,Technology,EDP Services
KPRX,Kiora Pharmaceuticals Inc.  Common Stock,$1.3399,0.0499,3.868%,16953827.00,United States,,107041,Health Care,Biotechnology: In Vitro & In Vivo Diagnostic Substances
KPTI,Karyopharm Therapeutics Inc. Common Stock,$7.165,-0.095,-1.309%,541297823.00,United States,2013,500795,Miscellaneous,Diversified Commercial Services
KRBP,Kiromic BioPharma Inc. Common Stock,$2.00,0.00,0.00%,30875378.00,United States,2020,61733,Consumer Durables,Specialty Chemicals
KRKR,36Kr Holdings Inc. American Depositary Shares,$1.35,0.10,8.00%,52048971.00,China,2019,31530,Miscellaneous,Business Services
KRMD,Repro Med Systems Inc. Common Stock,$3.4097,0.0397,1.178%,151940187.00,United States,,6403,Health Care,Medical/Dental Instruments
KRNL,Kernel Group Holdings Inc. Class A Ordinary Shares,$9.755,0.00,0.00%,371604531.00,United States,2021,8,Finance,Business Services
KRNLU,Kernel Group Holdings Inc. Units,$10.00,0.00,0.00%,0.00,United States,2021,509,Finance,Business Services
KRNLW,Kernel Group Holdings Inc. Warrants,$0.5299,-0.0033,-0.619%,0.00,United States,2021,21836,Finance,Business Services
KRNT,Kornit Digital Ltd. Ordinary Shares,$163.49,1.36,0.839%,7608287699.00,Israel,2015,136958,Capital Goods,Industrial Machinery/Components
KRNY,Kearny Financial Corp Common Stock,$12.94,0.02,0.155%,971146638.00,United States,,134989,Finance,Savings Institutions
KRON,Kronos Bio Inc. Common Stock,$13.27,0.21,1.608%,747728485.00,United States,2020,68466,Consumer Durables,Specialty Chemicals
KROS,Keros Therapeutics Inc. Common Stock,$55.575,1.615,2.993%,1300380363.00,United States,2020,94840,Consumer Durables,Specialty Chemicals
KRT,Karat Packaging Inc. Common Stock,$21.39,-0.10,-0.465%,423509679.00,United States,2021,1167,Capital Goods,Office Equipment/Supplies/Services
KRTX,Karuna Therapeutics Inc. Common Stock,$124.945,0.335,0.269%,3701315079.00,United States,2019,44553,Health Care,Biotechnology: Pharmaceutical Preparations
KRUS,Kura Sushi USA Inc. Class A Common Stock,$72.19,6.18,9.362%,700407160.00,United States,2019,26599,Consumer Services,Restaurants
KRYS,Krystal Biotech Inc. Common Stock,$76.825,5.795,8.159%,1913418892.00,United States,2017,422524,Health Care,Biotechnology: Biological Products (No Diagnostic Substances)
KSI,Kadem Sustainable Impact Corporation Class A common stock,$9.72,0.00,0.00%,212625000.00,United States,2021,5,,
KSICU,Kadem Sustainable Impact Corporation Unit,$10.01,0.01,0.10%,0.00,United States,2021,10200,,
KSICW,Kadem Sustainable Impact Corporation Warrant,$0.59,0.00,0.00%,0.00,United States,2021,6503,,
KSPN,Kaspien Holdings Inc. Common Stock,$13.2501,-0.2499,-1.851%,33026775.00,United States,,548,Consumer Services,Consumer Electronics/Video Chains
KTCC,Key Tronic Corporation Common Stock,$6.20,0.02,0.324%,66723600.00,United States,1983,18491,Technology,Computer peripheral equipment
KTOS,Kratos Defense & Security Solutions Inc. Common Stock,$20.59,0.26,1.279%,2552878844.00,United States,,260549,Consumer Non-Durables,Ordnance And Accessories
KTRA,Kintara Therapeutics Inc. Common Stock,$0.6925,0.0426,6.555%,33610722.00,United States,,302743,Health Care,Biotechnology: Pharmaceutical Preparations
KTTA,Pasithea Therapeutics Corp. Common Stock,$2.51,-0.09,-3.462%,54939811.00,United States,2021,774685,Health Care,Biotechnology: Pharmaceutical Preparations
KTTAW,Pasithea Therapeutics Corp. Warrant,$0.399,-0.002,-0.499%,0.00,United States,2021,23834,Health Care,Biotechnology: Pharmaceutical Preparations
KURA,Kura Oncology Inc. Common Stock,$12.875,-0.105,-0.809%,856905603.00,United States,,175319,Health Care,Biotechnology: Biological Products (No Diagnostic Substances)
KVHI,KVH Industries Inc. Common Stock,$10.0236,-0.0364,-0.362%,189436838.00,United States,1996,6064,Technology,Radio And Television Broadcasting And Communications Equipment
KVSA,Khosla Ventures Acquisition Co. Class A Common Stock,$9.80,0.02,0.204%,396802000.00,United States,2021,18148,,
KVSC,Khosla Ventures Acquisition Co. III Class A Common Stock,$9.88,0.03,0.305%,669437451.00,United States,2021,5559,,
KXIN,Kaixin Auto Holdings Ordinary Shares,$1.56,0.05,3.311%,223798372.00,China,2017,114296,Finance,Business Services
KYMR,Kymera Therapeutics Inc. Common Stock,$56.875,1.075,1.927%,2922643360.00,United States,2020,81806,Consumer Durables,Specialty Chemicals
KZIA,Kazia Therapeutics Limited American Depositary Shares,$8.2209,0.0909,1.118%,108525909.00,Australia,,5196,Health Care,Biotechnology: Pharmaceutical Preparations
KZR,Kezar Life Sciences Inc. Common Stock,$14.60,-0.06,-0.409%,717538871.00,United States,2018,151187,Health Care,Biotechnology: Pharmaceutical Preparations
LAAA,Lakeshore Acquisition I Corp. Ordinary Shares,$9.83,0.00,0.00%,69748028.00,China,2021,3,,
LAAAW,Lakeshore Acquisition I Corp. Warrant,$0.53,0.00,0.00%,0.00,China,2021,10,,
LABP,Landos Biopharma Inc. Common Stock,$6.64,0.10,1.529%,267164729.00,United States,2021,43936,Consumer Durables,Specialty Chemicals
LAKE,Lakeland Industries Inc. Common Stock,$19.33,-0.15,-0.77%,150883717.00,United States,1986,15779,,
LAMR,Lamar Advertising Company Class A Common Stock,$116.085,0.685,0.594%,11752385036.00,United States,1996,39780,Consumer Services,Real Estate Investment Trusts
LANC,Lancaster Colony Corporation Common Stock,$151.80,0.90,0.596%,4179054000.00,United States,,25394,Consumer Non-Durables,Packaged Foods
LAND,Gladstone Land Corporation Common Stock,$29.78,0.07,0.236%,1018774187.00,United States,1993,100457,Consumer Services,Real Estate Investment Trusts
LANDM,Gladstone Land Corporation 5.00% Series D Cumulative Term Preferred Stock,$25.53,0.00,0.00%,615334425.00,United States,,15,Consumer Services,Real Estate Investment Trusts
LANDO,Gladstone Land Corporation 6.00% Series B Cumulative Redeemable Preferred Stock,$25.94,-0.03,-0.116%,0.00,United States,,7320,Consumer Services,Real Estate Investment Trusts
LARK,Landmark Bancorp Inc. Common Stock,$28.99,0.49,1.719%,144888657.00,United States,,2310,Finance,Major Banks
LASR,nLIGHT Inc. Common Stock,$26.12,1.01,4.022%,1147206934.00,United States,2018,87140,Technology,Semiconductors
LAUR,Laureate Education Inc. Common Stock,$10.69,0.14,1.327%,1938489622.00,United States,2017,314928,Miscellaneous,Other Consumer Services
LAWS,Lawson Products Inc. Common Stock,$49.50,1.11,2.294%,449378177.00,United States,,4310,Capital Goods,Industrial Machinery/Components
LAXXU,8i Acquisition 2 Corp. Unit,$10.16,0.00,0.00%,0.00,Singapore,2021,15,,
LAZR,Luminar Technologies Inc.  Class A Common Stock,$16.06,0.41,2.62%,5806564788.00,United States,2019,1143192,Technology,EDP Services
LAZY,Lazydays Holdings Inc. Common Stock,$19.75,0.29,1.49%,245104353.00,United States,,50004,Consumer Services,Other Specialty Stores
LBAI,Lakeland Bancorp Inc. Common Stock,$17.995,-0.235,-1.289%,910661538.00,United States,,49098,Finance,Major Banks
LBC,Luther Burbank Corporation Common Stock,$14.32,-0.19,-1.309%,740174866.00,United States,2017,2462,Finance,Commercial Banks
LBPH,Longboard Pharmaceuticals Inc. Common Stock,$5.71,0.01,0.175%,98299649.00,United States,2021,15360,Health Care,Biotechnology: Pharmaceutical Preparations
LBPS,4D pharma plc American Depositary Shares,$6.4475,0.00,0.00%,145311305.00,United Kingdom,,284,Health Care,Biotechnology: Pharmaceutical Preparations
LBPSW,4D pharma plc Warrant,$0.64,0.038,6.312%,0.00,United Kingdom,,12231,Health Care,Biotechnology: Pharmaceutical Preparations
LBRDA,Liberty Broadband Corporation Class A Common Stock,$152.885,-2.315,-1.492%,26996474426.00,United States,,120034,Consumer Services,Telecommunications Equipment
LBRDK,Liberty Broadband Corporation Class C Common Stock,$155.58,-2.69,-1.70%,27472358251.00,United States,,582300,Consumer Services,Telecommunications Equipment
LBRDP,Liberty Broadband Corporation Series A Cumulative Redeemable Preferred Stock,$28.52,-0.4399,-1.519%,0.00,United States,,187,Consumer Services,Telecommunications Equipment
LBTYA,Liberty Global plc Class A Ordinary Shares,$27.33,0.11,0.404%,14838025109.00,United Kingdom,,542846,Consumer Services,Television Services
LBTYB,Liberty Global plc Class B Ordinary Shares,$28.00,0.00,0.00%,15201782036.00,United Kingdom,,32,Consumer Services,Television Services
LBTYK,Liberty Global plc Class C Ordinary Shares,$27.39,0.04,0.146%,14870600356.00,United Kingdom,,877917,Consumer Services,Television Services
LCA,Landcadia Holdings IV Inc. Class A Common Stock,$9.78,0.00,0.00%,611250000.00,United States,2021,1543,,
LCAA,L Catterton Asia Acquisition Corp Class A Ordinary Shares,$9.71,-0.05,-0.512%,347749978.00,Singapore,2021,22505,Finance,Business Services
LCAAW,L Catterton Asia Acquisition Corp Warrant,$0.9301,0.00,0.00%,0.00,Singapore,2021,1,Finance,Business Services
LCAHU,Landcadia Holdings IV Inc. Units,$10.08,0.00,0.00%,0.00,United States,2021,500,,
LCAHW,Landcadia Holdings IV Inc. Warrant ,$1.31,0.00,0.00%,0.00,United States,2021,195,,
LCAP,Lionheart Acquisition Corp. II Class A Common Stock,$9.94,0.00,0.00%,292236000.00,United States,2020,290,,
LCAPU,Lionheart Acquisition Corp. II Unit,$10.31,-0.06,-0.579%,0.00,United States,2020,200,,
LCAPW,Lionheart Acquisition Corp. II Warrant,$0.75,-0.03,-3.846%,0.00,United States,2020,600,,
LCID,Lucid Group Inc. Common Stock,$44.48,0.60,1.367%,73230401714.00,United States,,33699553,Capital Goods,Auto Manufacturing
LCNB,LCNB Corporation Common Stock,$19.98,-0.20,-0.991%,283880276.00,United States,,4092,Finance,Major Banks
LCUT,Lifetime Brands Inc. Common Stock,$16.67,-0.09,-0.537%,367043277.00,United States,1991,1929,Consumer Durables,Home Furnishings
LDHA,LDH Growth Corp I Class A Ordinary Shares,$9.82,0.00,0.00%,282325000.00,United States,2021,70,Finance,Business Services
LDHAU,LDH Growth Corp I Units,$9.98,0.06,0.605%,0.00,United States,2021,2550,Finance,Business Services
LDHAW,LDH Growth Corp I Warrant,$0.83,-0.0126,-1.495%,0.00,United States,2021,26300,Finance,Business Services
LE,Lands' End Inc. Common Stock,$20.27,-0.09,-0.442%,668525417.00,United States,,69324,Consumer Services,Clothing/Shoe/Accessory Stores
LECO,Lincoln Electric Holdings Inc. Common Shares,$136.34,0.33,0.243%,8050643177.00,United States,,42195,Capital Goods,Industrial Machinery/Components
LEDS,SemiLEDS Corporation Common Stock,$6.1256,0.1356,2.264%,27317597.00,Taiwan,2010,172857,Technology,Semiconductors
LEE,Lee Enterprises Incorporated Common Stock,$24.93,0.08,0.322%,146812346.00,United States,,35692,Consumer Services,Newspapers/Magazines
LEGA,Lead Edge Growth Opportunities Ltd Class A Ordinary Shares,$9.80,0.02,0.204%,422625000.00,United States,2021,5705,Finance,Business Services
LEGAU,Lead Edge Growth Opportunities Ltd Units,$9.8601,0.00,0.00%,0.00,United States,2021,90,Finance,Business Services
LEGAW,Lead Edge Growth Opportunities Ltd Warrant,$0.7099,0.0099,1.414%,0.00,United States,2021,2499,Finance,Business Services
LEGH,Legacy Housing Corporation Common Stock (TX),$25.29,0.25,0.998%,612259671.00,United States,2018,14226,Basic Industries,Homebuilding
LEGN,Legend Biotech Corporation American Depositary Shares,$50.37,0.98,1.984%,7289246598.00,United States,2020,87910,Health Care,Biotechnology: Pharmaceutical Preparations
LESL,Leslie's Inc. Common Stock,$21.91,-0.04,-0.182%,4158030919.00,United States,2020,463746,Consumer Services,
LEVL,Level One Bancorp Inc. Common Stock,$38.74,-0.33,-0.845%,295994675.00,United States,2018,1770,,
LEVLP,Level One Bancorp Inc. Depositary Shares Each Representing a 1/100th Interest in a Share of 7.50% Non-Cumulative Perpetual Preferred Stock Series B,$27.31,0.00,0.00%,0.00,United States,,200,,
LEXX,Lexaria Bioscience Corp. Common Stock,$5.23,0.31,6.301%,29950636.00,Canada,,12004836,Health Care,Biotechnology: Pharmaceutical Preparations
LEXXW,Lexaria Bioscience Corp. Warrant,$1.7109,0.0717,4.374%,0.00,Canada,,6496,Health Care,Biotechnology: Pharmaceutical Preparations
LFACU,LF Capital Acquisition Corp. II Units,$10.07,-0.03,-0.297%,0.00,United States,2021,136457,,
LFMD,LifeMD Inc. Common Stock,$4.8989,0.3289,7.197%,149873366.00,United States,,246681,Miscellaneous,Diversified Commercial Services
LFMDP,LifeMD Inc. 8.875% Series A Cumulative Perpetual Preferred Stock,$20.10,-0.60,-2.899%,0.00,United States,,8758,Miscellaneous,Diversified Commercial Services
LFST,LifeStance Health Group Inc. Common Stock,$9.38,0.04,0.428%,3509514318.00,United States,2021,1496909,Health Care,Hospital/Nursing Management
LFTR,Lefteris Acquisition Corp. Class A Common Stock,$9.815,-0.005,-0.051%,254084507.00,United States,2020,791,,
LFTRU,Lefteris Acquisition Corp. Unit,$10.04,0.00,0.00%,0.00,United States,2020,91,,
LFTRW,Lefteris Acquisition Corp. Warrant,$0.83,-0.03,-3.488%,0.00,United States,2020,110627,,
LFUS,Littelfuse Inc. Common Stock,$311.28,0.95,0.306%,7667457365.00,United States,,17266,Technology,Electronic Components
LFVN,Lifevantage Corporation Common Stock (Delaware),$6.70,0.10,1.515%,88730365.00,United States,,15625,Consumer Non-Durables,Farming/Seeds/Milling
LGAC,Lazard Growth Acquisition Corp. I Ordinary Shares,$9.77,0.00,0.00%,702218750.00,,2021,11204,Finance,Business Services
LGACU,Lazard Growth Acquisition Corp. I Units,$10.00,0.00,0.00%,0.00,,2021,50,Finance,Business Services
LGACW,Lazard Growth Acquisition Corp. I Warrants,$0.99,0.08,8.791%,0.00,,2021,476,Finance,Business Services
LGHL,Lion Group Holding Ltd. American Depositary Share,$1.795,0.005,0.279%,70312440.00,China,,72930,Finance,Investment Bankers/Brokers/Service
LGHLW,Lion Group Holding Ltd. Warrant,$0.1247,0.0002,0.161%,0.00,China,,12628,Finance,Investment Bankers/Brokers/Service
LGIH,LGI Homes Inc. Common Stock,$158.06,1.19,0.759%,3836620569.00,United States,2013,104866,Capital Goods,Homebuilding
LGND,Ligand Pharmaceuticals Incorporated Common Stock,$153.64,-0.66,-0.428%,2567576523.00,United States,,21995,Health Care,Biotechnology: Pharmaceutical Preparations
LGO,Largo Inc. Common Shares,$9.50,-0.10,-1.042%,614897000.00,Canada,,25469,,
LGSTU,Semper Paratus Acquisition Corporation Unit,$10.11,0.01,0.099%,0.00,United States,2021,430,,
LGTOU,Legato Merger Corp. II Unit,$10.10,0.02,0.198%,0.00,United States,2021,16600,,
LGVCU,LAMF Global Ventures Corp. I Unit,$10.08,0.00,0.00%,0.00,United States,2021,8,,
LGVN,Longeveron Inc. Class A Common Stock,$20.20,0.62,3.166%,409856344.00,United States,2021,5060248,Consumer Durables,Specialty Chemicals
LHAA,Lerer Hippeau Acquisition Corp. Class A Common Stock,$9.75,-0.01,-0.102%,278051036.00,United States,2021,7856,,
LHCG,LHC Group Common Stock,$132.455,6.635,5.273%,4195008796.00,United States,2005,208788,Health Care,Medical/Nursing Services
LHDX,Lucira Health Inc. Common Stock,$6.05,0.15,2.542%,237308534.00,United States,2021,67112,Health Care,Biotechnology: Electromedical & Electrotherapeutic Apparatus
LI,Li Auto Inc. American Depositary Shares,$31.78,0.84,2.715%,32824217865.00,China,2020,3528002,Capital Goods,Auto Manufacturing
LIAN,LianBio American Depositary Shares,$9.96,-0.14,-1.386%,1048359859.00,United States,2021,127034,,
LIBYU,Liberty Resources Acquisition Corp. Unit,$10.16,-0.01,-0.098%,0.00,United States,2021,100,,
LIDR,AEye Inc. Class A Common Stock,$5.10,0.20,4.082%,788436744.00,United States,2021,334982,Capital Goods,Auto Parts:O.E.M.
LIDRW,AEye Inc. Warrant,$0.7922,0.0721,10.012%,0.00,United States,2021,94561,Capital Goods,Auto Parts:O.E.M.
LIFE,aTyr Pharma Inc. Common Stock,$8.52,0.33,4.029%,236776568.00,United States,2015,68956,Health Care,Biotechnology: Biological Products (No Diagnostic Substances)
LILA,Liberty Latin America Ltd. Class A Common Stock,$11.78,0.01,0.085%,2731081326.00,United States,,103941,Consumer Services,Television Services
LILAK,Liberty Latin America Ltd. Class C Common Stock,$11.48,-0.02,-0.174%,2661529170.00,United States,,210102,Consumer Services,Television Services
LILM,Lilium N.V. Class A Ordinary Shares,$7.28,0.27,3.852%,2068321230.00,Germany,,359676,,
LILMW,Lilium N.V. Warrants,$1.71,0.10,6.211%,0.00,Germany,,101201,,
LINC,Lincoln Educational Services Corporation Common Stock,$7.815,-0.045,-0.573%,211010369.00,United States,2005,115200,Miscellaneous,Service to the Health Industry
LIND,Lindblad Expeditions Holdings Inc. Common Stock,$16.50,0.39,2.421%,828302855.00,United States,2013,150145,,
LINK,Interlink Electronics Inc. Common Stock,$10.01,-0.09,-0.891%,66091005.00,United States,,1078,Capital Goods,Industrial Machinery/Components
LIONU,Lionheart III Corp Unit,$10.01,0.00,0.00%,0.00,United States,2021,5,,
LIONW,Lionheart III Corp Warrant,$0.5111,0.0011,0.216%,0.00,United States,2021,332499,,
LIQT,LiqTech International Inc. Common Stock,$5.335,0.195,3.794%,113559242.00,Denmark,,29604,Capital Goods,Industrial Machinery/Components
LITE,Lumentum Holdings Inc. Common Stock,$91.86,1.28,1.413%,6641478000.00,United States,,309317,Technology,Computer peripheral equipment
LITM,Snow Lake Resources Ltd. Common Shares,$6.85,0.19,2.853%,111039706.00,Canada,2021,421362,,
LITTW,Logistics Innovation Technologies Corp. Warrant,$1.19,0.0592,5.235%,0.00,United States,2021,2160,,
LIVE,Live Ventures Incorporated Common Stock,$34.25,-0.65,-1.862%,53801065.00,United States,,961,Capital Goods,Recreational Products/Toys
LIVN,LivaNova PLC Ordinary Shares,$84.00,2.08,2.539%,4470941664.00,United Kingdom,,112735,Health Care,Biotechnology: Electromedical & Electrotherapeutic Apparatus
LIXT,Lixte Biotechnology Holdings Inc. Common Stock,$1.495,0.085,6.028%,20551157.00,United States,,32390,Health Care,Biotechnology: Pharmaceutical Preparations
LIXTW,Lixte Biotechnology Holdings Inc. Warrants,$0.2424,-0.0362,-12.994%,0.00,United States,,3401,Health Care,Biotechnology: Pharmaceutical Preparations
LIZI,LIZHI INC. American Depositary Shares,$2.04,0.21,11.475%,103234116.00,China,2020,888803,Technology,Computer Software: Programming Data Processing
LJAQ,LightJump Acquisition Corporation Common Stock,$9.87,0.02,0.203%,171441900.00,United States,2021,4575,,
LJAQU,LightJump Acquisition Corporation Unit,$10.14,0.05,0.496%,0.00,United States,2021,100,,
LJAQW,LightJump Acquisition Corporation Warrant,$0.60,0.0555,10.193%,0.00,United States,2021,500,,
